{
  "schema_version": "1.0.0",
  "snapshot_id": "GRAPH-SNAPSHOT-000005",
  "generated_from": [
    "data/ledger/events.jsonl",
    "candidates/CANDIDATE-000001.json",
    "candidates/CANDIDATE-000002.json",
    "artifacts/results/CANDIDATE-000001.result.json",
    "artifacts/results/CANDIDATE-000002.result.json",
    "artifacts/reproductions/CANDIDATE-000001.crosscheck.json",
    "artifacts/reproductions/CANDIDATE-000002.crosscheck.json",
    "artifacts/reproductions/INTERNAL-CLEAN-CLONE-000001.json",
    "artifacts/reviews/REVIEW-000002.json",
    "benchmarks/BENCHMARK-000002.passport.json",
    "candidates/CANDIDATE-000003.json",
    "benchmarks/BENCHMARK-000003.passport.json",
    "artifacts/results/CANDIDATE-000003.result.json",
    "artifacts/reproductions/CANDIDATE-000003.einsteinpy-crosscheck.json",
    "docs/SCIENTIFIC_CLAIMS_POLICY.md"
  ],
  "nodes": [
    {"id": "RQ-000001", "type": "ResearchQuestion", "label": "Can systematic computational search map spacetime solution space?", "status": "OPEN", "canonical": true, "summary": "The project's methodological research question. It does not presume a transportation shortcut exists.", "href": "/method/"},
    {"id": "HYPOTHESIS-000001", "type": "Hypothesis", "label": "Search may outperform isolated manual proposal", "status": "UNTESTED", "canonical": true, "summary": "A reproducible search policy may classify or identify scientifically interesting regions more efficiently than a defined naive baseline.", "href": "/method/#hypothesis"},
    {"id": "CHALLENGE-000001", "type": "Challenge", "label": "Earth to Mars benchmark", "status": "FRAMED", "canonical": true, "summary": "Mars is a motivating benchmark and communication frame, not a claim that the project can alter travel today.", "href": "/#mars-benchmark"},
    {"id": "FAMILY-000001", "type": "CandidateFamily", "label": "Flat spacetime baselines", "status": "ACTIVE", "canonical": true, "summary": "Simple metrics used to verify that the pipeline handles established mathematics before exploring novelty.", "href": "/lab/"},
    {"id": "CANDIDATE-000001", "type": "Candidate", "label": "Minkowski baseline", "status": "DRAFT", "canonical": true, "summary": "The standard constant flat-spacetime metric in Cartesian coordinates.", "href": "/lab/#candidate"},
    {"id": "VALIDATOR-000001", "type": "Validator", "label": "Scoped Minkowski benchmark validator", "status": "EXPERIMENTAL", "canonical": true, "summary": "Exact arithmetic checks for the Cartesian baseline and one declared constant linear coordinate map.", "href": "/lab/#validator"},
    {"id": "RUN-000001", "type": "Run", "label": "Baseline deterministic verification run", "status": "BASELINE_VERIFIED", "canonical": true, "summary": "Twelve implemented checks passed using exact arithmetic and scoped analytic implications.", "href": "/lab/#result"},
    {"id": "CLAIM-000001", "type": "Claim", "label": "The stored baseline metric is exactly flat in its declared scope", "status": "COMPUTATION_SUPPORTED", "canonical": true, "summary": "Supported by the versioned baseline validator and exact committed artifact. Not independently reproduced yet.", "href": "/lab/#result"},
    {"id": "REPRODUCTION-QUEUE-000001", "type": "ReproductionQueue", "label": "Independent reproduction requested", "status": "OPEN", "canonical": false, "summary": "An outside contributor should rerun the baseline from a clean clone and compare the fingerprint.", "href": "/contribute/#reproduce"},
    {"id": "SEARCH-POLICY-000001", "type": "SearchPolicy", "label": "No learned search policy deployed", "status": "NOT_STARTED", "canonical": true, "summary": "The project has not trained or promoted any model. Benchmarks and data governance come first.", "href": "/graph/#learning-loop"},
    {"id": "CANDIDATE-000002", "type": "Candidate", "label": "Rescaled-coordinate Minkowski benchmark", "status": "DRAFT", "canonical": true, "summary": "The same flat spacetime expressed through one declared constant linear coordinate map.", "href": "/lab/#benchmark-ladder"},
    {"id": "RUN-000002", "type": "Run", "label": "Superseded coordinate-equivalence run", "status": "SUPERSEDED_PROVENANCE_CORRECTED", "canonical": true, "summary": "The original mathematics passed, but its source commit predated the implementation and was corrected by Run 000003.", "href": "/lab/#benchmark-ladder"},
    {"id": "RUN-000003", "type": "Run", "label": "Passport-bound coordinate-equivalence run", "status": "BENCHMARK_VERIFIED", "canonical": true, "summary": "Fourteen checks passed against passport 1.0.1 using exact arithmetic from source commit 038b8e3a9d7f.", "href": "/lab/#benchmark-ladder"},
    {"id": "CORRECTION-000001", "type": "Correction", "label": "Benchmark 000002 review corrections", "status": "CLOSED_APPROVED", "canonical": true, "summary": "Exact passport binding, honest secondary comparison scope, and source-commit provenance were corrected after Review 000001 and approved by Review 000002.", "href": "/lab/#benchmark-ladder"},
    {"id": "CLAIM-000002", "type": "Claim", "label": "Two submitted component grids describe the same scoped flat geometry", "status": "COMPUTATION_SUPPORTED_IMPLEMENTATION_REVIEW_APPROVED", "canonical": true, "summary": "The passport-bound implementation and artifacts passed re-review; outside scientific reproduction remains open.", "href": "/lab/#benchmark-ladder"},
    {"id": "REVIEW-000002", "type": "Review", "label": "Coordinate benchmark implementation re-review", "status": "APPROVED", "canonical": true, "summary": "Seven requested implementation and provenance corrections were independently verified at PR 6 head 4b2e24d; no remaining objections were reported.", "href": "/data/review-000002.json"},
    {"id": "REPRODUCTION-INTERNAL-CLEAN-CLONE-000001", "type": "Reproduction", "label": "Internal clean-clone SymPy reproduction", "status": "INTERNAL_MATCH_UNSIGNED", "canonical": true, "summary": "A clean remote clone reproduced both digests and matched through SymPy; operator conflicts are disclosed, no signing key was available, and no outside-reproduction credit is claimed.", "href": "/data/internal-clean-clone-reproduction.json"},
    {"id": "FAMILY-000002", "type": "CandidateFamily", "label": "Established curved-spacetime benchmarks", "status": "ACTIVE", "canonical": true, "summary": "Known curved solutions used to calibrate symbolic tensor calculations before any novel proposal.", "href": "/lab/#curved-benchmark"},
    {"id": "CANDIDATE-000003", "type": "Candidate", "label": "Schwarzschild exterior benchmark", "status": "DRAFT_REVIEW_REQUESTED", "canonical": true, "summary": "The established exterior vacuum geometry of a spherical non-rotating mass in a restricted curvature-coordinate chart.", "href": "/lab/#curved-benchmark"},
    {"id": "VALIDATOR-000002", "type": "Validator", "label": "Passport-bound symbolic curved validator", "status": "EXPERIMENTAL", "canonical": true, "summary": "Restricted symbolic parsing and exact SymPy tensor calculations for one preregistered Schwarzschild exterior profile.", "href": "/lab/#curved-benchmark"},
    {"id": "RUN-000004", "type": "Run", "label": "Schwarzschild exterior symbolic verification", "status": "BENCHMARK_VERIFIED_INTERNAL", "canonical": true, "summary": "Seventeen preregistered checks passed at source commit 5a6a5fe4f827; outside scientific review remains requested.", "href": "/data/result-000003.json"},
    {"id": "CLAIM-000003", "type": "Claim", "label": "The submitted exterior metric matches the established Schwarzschild vacuum benchmark", "status": "INTERNAL_COMPUTATION_SUPPORTED_REVIEW_REQUESTED", "canonical": true, "summary": "The bounded primary and EinsteinPy paths agree under the declared domain and conventions; this is not a novel-physics or transportation claim.", "href": "/lab/#curved-benchmark"},
    {"id": "REPRODUCTION-EINSTEINPY-000003", "type": "Reproduction", "label": "Internal EinsteinPy comparison for Candidate 000003", "status": "INTERNAL_MATCH_UNSIGNED", "canonical": true, "summary": "EinsteinPy matches eight declared comparisons. Same owner, machine, credentials, and Codex workflow are disclosed; it is unsigned and not external evidence.", "href": "/data/crosscheck-000003.json"}
  ],
  "edges": [
    {"id": "EDGE-000001", "source": "RQ-000001", "target": "HYPOTHESIS-000001", "relationship": "FRAMES", "canonical": true, "summary": "The research question is tested through a methodological hypothesis."},
    {"id": "EDGE-000002", "source": "CHALLENGE-000001", "target": "RQ-000001", "relationship": "MOTIVATES", "canonical": true, "summary": "The Mars benchmark makes the abstract research question concrete."},
    {"id": "EDGE-000003", "source": "CANDIDATE-000001", "target": "FAMILY-000001", "relationship": "INSTANCE_OF", "canonical": true, "summary": "The candidate is a flat-spacetime baseline."},
    {"id": "EDGE-000004", "source": "RUN-000001", "target": "CANDIDATE-000001", "relationship": "EVALUATES", "canonical": true, "summary": "The run evaluates the committed candidate document."},
    {"id": "EDGE-000005", "source": "RUN-000001", "target": "VALIDATOR-000001", "relationship": "USES", "canonical": true, "summary": "The run records the validator identity and version."},
    {"id": "EDGE-000006", "source": "CLAIM-000001", "target": "RUN-000001", "relationship": "SUPPORTED_BY", "canonical": true, "summary": "The claim is narrower than and directly traceable to the run output."},
    {"id": "EDGE-000007", "source": "REPRODUCTION-QUEUE-000001", "target": "RUN-000001", "relationship": "REQUESTS_REPRODUCTION_OF", "canonical": false, "summary": "Independent reproduction remains open."},
    {"id": "EDGE-000008", "source": "SEARCH-POLICY-000001", "target": "HYPOTHESIS-000001", "relationship": "WILL_TEST", "canonical": true, "summary": "A future versioned search policy will be compared with a naive baseline."},